{
  "submission_id": "ref-xd-p1-chem-001-v2-20260731",
  "claim_id": "XD-P1-CHEM-001",
  "title": "Chemical path competition V2: effective activation energy vs Arrhenius kinetics",
  "author": {
    "name": "reference-implementation",
    "affiliation": "open-validation",
    "contact": ""
  },
  "preregistration": {
    "hash": "in-script-preregistered-constants-v2",
    "timestamp_utc": "2026-07-31T00:00:00+00:00",
    "uri": "known-issues.md#issue-004"
  },
  "implementation": {
    "repository": "",
    "commit": "",
    "code_hash": "d84db6d63bd4540812b882d3d97fbfaea6a2107db79672e144c87d78c78871ca",
    "data_hash": "",
    "seed": 0,
    "environment": {
      "os": "Windows-10-10.0.19045-SP0",
      "python_version": "3.13.5",
      "dependencies": "python-stdlib-only"
    }
  },
  "result": {
    "S_A": 31980.96,
    "S_B": 55000.0,
    "preferred_path": "A",
    "selected_counts": {
      "A": 16,
      "B": 0
    },
    "p_value": 1.5e-5,
    "summary": "EXAMPLE FILE (format reference; content copied from ref-xd-p1-chem-001-v2-20260731): V2 (E_eff) 16/16 temps match; p=1.5e-5; support (L4_candidate)",
    "raw_output": {
      "E_definition": "effective activation energy (steady-state approximation)",
      "N_definition": "1 (one reaction event)",
      "S_definition": "S = E_eff = -R*T*ln(k_eff/A_pre)",
      "configs": ["symmetric", "asymmetric"],
      "total_temps": 16,
      "matches": 16
    }
  },
  "classification": "support",
  "timestamp_utc": "2026-08-01T05:46:52.959200+00:00"
}